{
  "$schema": "https://json-schema.org/draft/2020-12/schema",
  "$id": "https://a2-schema.org/tier-configs/_meta/v0.1.0/schema.json",
  "title": "a2-schema Tier Config v0.1.0",
  "version": "0.1.0",
  "description": "Meta-schema for a2-schema tier configs. A tier config is a BUILD MANIFEST (not an instance schema): it selects defs from the Grand Vault and drives the strip that produces a self-contained tiered schema.",
  "license": "Apache-2.0",
  "x-a2-role": "meta-schema",
  "type": "object",
  "required": [
    "kind",
    "tier",
    "version",
    "imports",
    "defs"
  ],
  "properties": {
    "$schema": {
      "type": "string"
    },
    "$id": {
      "type": "string",
      "format": "uri"
    },
    "kind": {
      "const": "tier-config"
    },
    "tier": {
      "type": "string"
    },
    "version": {
      "type": "string"
    },
    "x-strip-mode": {
      "enum": [
        "selection",
        "thinning"
      ]
    },
    "description": {
      "type": "string"
    },
    "imports": {
      "type": "object",
      "additionalProperties": {
        "type": "string",
        "format": "uri"
      }
    },
    "profiles": {
      "type": "array",
      "items": {
        "type": "string",
        "format": "uri"
      }
    },
    "baseSchemas": {
      "type": "object",
      "additionalProperties": {
        "type": "object",
        "properties": {
          "schemaHash": {
            "type": "string"
          },
          "lastSyncedAt": {
            "type": "string",
            "format": "date-time"
          }
        }
      }
    },
    "defs": {
      "type": "object",
      "additionalProperties": {
        "type": "object",
        "properties": {
          "selected": {
            "type": "boolean"
          }
        }
      }
    }
  },
  "additionalProperties": true
}