{
  "$schema": "https://a2-schema.org/tier-config/v0.1.0/schema.json",
  "$id": "https://a2-schema.org/tier-configs/a2-compliance/v0.0.1/config.json",
  "kind": "tier-config",
  "tier": "a2-compliance",
  "version": "0.0.1",
  "x-strip-mode": "selection",
  "description": "Tier config for the a2-Compliance app: SOC 2 / ISO 27001 / GDPR / EU AI Act / HIPAA / PCI DSS — automated evidence collection, audit trail, signed compliance records.",
  "imports": {
    "main": "https://a2-schema.org/vault/v0.0.9/schema.json"
  },
  "profiles": [
    "https://a2-schema.org/profiles/compliance/v0.0.1/schema.json",
    "https://a2-schema.org/profiles/signature/v0.0.2/schema.json"
  ],
  "baseSchemas": {
    "main": {
      "schemaHash": "sha256:60597de2054d3a31bb1d3c91aee0c87aad722e15a3a429c3b9420ecc26445a08",
      "lastSyncedAt": "2026-06-15T00:00:00Z"
    }
  },
  "defs": {
    "A2Envelope": {
      "selected": true
    },
    "Root": {
      "selected": true
    },
    "Header": {
      "selected": true
    },
    "NodeIdType": {
      "selected": true
    },
    "SemanticType": {
      "selected": true
    },
    "SemanticBlock": {
      "selected": true
    },
    "Value": {
      "selected": true
    },
    "HashChain": {
      "selected": true
    },
    "BlockHashChain": {
      "selected": true
    },
    "AIAction": {
      "selected": true
    },
    "Instruction": {
      "selected": true
    },
    "AuditSession": {
      "selected": true
    },
    "MLDSAAlgorithmEnum": {
      "selected": true
    },
    "BlockSignature": {
      "selected": true
    },
    "SignatureBundle": {
      "selected": true
    },
    "SigningCeremony": {
      "selected": true
    },
    "CeremonyParticipant": {
      "selected": true
    },
    "IALLevel": {
      "selected": true
    },
    "AALLevel": {
      "selected": true
    },
    "FALLevel": {
      "selected": true
    },
    "ComplianceLog": {
      "selected": true
    },
    "ComplianceFrameworkEnum": {
      "selected": true
    },
    "ConsentReceipt": {
      "selected": true
    },
    "DataLineage": {
      "selected": true
    },
    "DataSubjectRequest": {
      "selected": true
    },
    "IncidentReport": {
      "selected": true
    },
    "AccessControlEvent": {
      "selected": true
    },
    "PIIDetection": {
      "selected": true
    },
    "GovernanceAttestation": {
      "selected": true
    }
  }
}