{
  "$schema": "https://a2-schema.org/tier-config/v0.1.0/schema.json",
  "kind": "tier-config",
  "tier": "a2-doc",
  "version": "0.0.3",
  "x-strip-mode": "selection",
  "description": "General-purpose document tier (not contract-specific). Updated for SSoT v0.0.8.",
  "imports": {
    "main": "https://a2-schema.org/vault/v0.0.8/schema.json"
  },
  "profiles": [
    "https://a2-schema.org/profiles/signature/v0.0.1/schema.json"
  ],
  "baseSchemas": {
    "main": {
      "schemaHash": "sha256:b0afc752b3b7ea2e6144001dd0e62336d371bf08c0410b76beaff0bab801bcb2",
      "lastSyncedAt": "2026-06-15T00:00:00Z"
    }
  },
  "defs": {
    "A2Envelope": {
      "selected": true
    },
    "BiometricCapture": {
      "selected": true
    },
    "BlockHashChain": {
      "selected": true
    },
    "BlockSignature": {
      "selected": true
    },
    "ClassificationEnum": {
      "selected": true
    },
    "CodeStringType": {
      "selected": true
    },
    "ComparatorEnum": {
      "selected": true
    },
    "ConfidenceType": {
      "selected": true
    },
    "CurrencyType": {
      "selected": true
    },
    "DecimalsType": {
      "selected": true
    },
    "DirEnum": {
      "selected": true
    },
    "EncodingEnum": {
      "selected": true
    },
    "ExternalPayload": {
      "selected": true
    },
    "HandwrittenSignature": {
      "selected": true
    },
    "HashChain": {
      "selected": true
    },
    "JAdESEtsiUEntry": {
      "selected": true
    },
    "JAdESProfileEnum": {
      "selected": true
    },
    "JAdESRVals": {
      "selected": true
    },
    "JAdESSigTst": {
      "selected": true
    },
    "JAdESTstVD": {
      "selected": true
    },
    "JAdESXVals": {
      "selected": true
    },
    "JCSCanonicalizationEnum": {
      "selected": true
    },
    "JWSProtectedHeaderDecoded": {
      "selected": true
    },
    "LegacySignatureAlgEnum": {
      "selected": true
    },
    "MLDSAAlgorithmEnum": {
      "selected": true
    },
    "MimeTypeType": {
      "selected": true
    },
    "NodeIdType": {
      "selected": true
    },
    "NullFlavorEnum": {
      "selected": true
    },
    "PrecisionType": {
      "selected": true
    },
    "QualityEnum": {
      "selected": true
    },
    "ScaleType": {
      "selected": true
    },
    "SemanticBlock": {
      "selected": true
    },
    "SemanticBlockTypeEnum": {
      "selected": true
    },
    "SemanticType": {
      "selected": true
    },
    "SemanticUnitType": {
      "selected": true
    },
    "SignatureAlgorithmType": {
      "selected": true
    },
    "SignatureBundle": {
      "selected": true
    },
    "SigningCeremony": {
      "selected": true
    },
    "StatEnum": {
      "selected": true
    },
    "UncertaintyType": {
      "selected": true
    },
    "UnitSystemEnum": {
      "selected": true
    },
    "Value": {
      "selected": true
    }
  },
  "$id": "https://a2-schema.org/tier-configs/a2-doc/v0.0.3/config.json"
}